ticket_id,opened_at,category,subcategory,assignment_group,priority,short_description,work_notes,close_notes,status,business_unit,location,country,state
INC0001072,2025-04-20 04:12,Security,Identity & Access,Service Desk,4 - Low,Request role for new starter,permission missing on the account. synced the account in Active Directory and confirmed login works.,Granted password and unlocked the account. Closing per requester confirmation.,Closed,Logistics & Supply Chain,San Jose Office,United States,California
INC0001024,2025-04-21 03:08,Security,Identity & Access,Service Desk,3 - Moderate,User password expired,account locked on the license. added the user to the security group and confirmed login works.,synced the account in Active Directory; user confirms login to SSO successful.,Resolved,Logistics & Supply Chain,Sydney Hub,Australia,New South Wales
INC0001030,2025-04-21 16:18,Hardware,Cross-functional,Desktop Support,3 - Moderate,New laptop cannot connect to Wi-Fi after reimage,"Reimaged laptop running slow on Wi-Fi. Updated the wireless driver, reset the network adapter.","cleaned the fan vents and reset the network adapter. Laptop online, user confirms connectivity.",Resolved,Sales & Marketing,Manchester Office,United Kingdom,England
INC0001050,2025-04-21 20:11,Hardware,Printing,Desktop Support,2 - High,Cannot print to Xerox MFP - error 49,Job stuck in the default printer. restarted the print server and released the job successfully.,"restarted the print server; test page prints clean, double-sided not working resolved.",Closed Complete,Retail Banking,Frankfurt DC,Germany,Hesse
INC0001034,2025-04-22 04:51,Network,Connectivity,Network Operations,3 - Moderate,User intermittent drops on Ethernet,Wireless cannot connect traced to a weak network drive. reseated the Ethernet cable.,"reset the network adapter; VLAN stable, user confirms connection restored.",Closed Complete,Manufacturing,Mumbai Campus,India,Maharashtra
INC0001065,2025-04-23 12:49,Software,Email & Collaboration,Messaging Support,3 - Moderate,Microsoft 365 duplicate emails for user shared inbox,User reports Teams cannot receive. Confirmed mailbox is online. removed and re-added the account.,Resolved keeps crashing after rebuilt the OST file. Mailbox syncing normally.,Closed,Corporate Functions,San Jose Office,United States,California
INC0001035,2025-04-23 15:56,Network,Connectivity,Network Operations,4 - Low,no internet over Ethernet,Wireless intermittent drops traced to a weak IP address. renewed the DHCP lease.,"updated the wireless driver; firewall stable, user confirms connection restored.",Closed,Sales & Marketing,London HQ,United Kingdom,England
INC0001003,2025-04-26 05:43,Software,Email & Collaboration,Messaging Support,4 - Low,Exchange cannot receive,"Mailbox over quota causing stuck in outbox. Archived old items, then recreated the Outlook profile.","Added user to the contact. Verified mail delivery, closing ticket.",Closed,Manufacturing,Toronto Office,Canada,Ontario
INC0001037,2025-04-26 17:02,Hardware,Printing,Desktop Support,4 - Low,Replace paper tray on print server,Driver mismatch causing paper jam. reinstalled the print driver and printed a test page.,"cleared the paper jam from the tray; test page prints clean, out of toner resolved.",Closed,Sales & Marketing,Dallas Office,United States,Texas
INC0001075,2025-04-27 04:14,Software,Email & Collaboration,Messaging Support,4 - Low,User cannot access calendar in Microsoft 365,Verified the rule configuration. rebuilt the OST file to resolve the sync error.,Resolved cannot receive after removed and re-added the account. Mailbox syncing normally.,Closed Complete,Manufacturing,Dallas Office,United States,Texas
INC0001042,2025-04-29 16:19,Security,Identity & Access,Service Desk,4 - Low,User MFA not prompting,MFA issue: access denied. re-enrolled MFA and tested a sign-in.,Resolved needs access after unlocked the account. Access verified.,Closed,Logistics & Supply Chain,Manchester Office,United Kingdom,England
INC0001046,2025-04-29 19:03,Software,Email & Collaboration,Messaging Support,4 - Low,Request to add member to rule,User reports Outlook Web App keeps crashing. Confirmed mailbox is online. rebuilt the OST file.,Resolved cannot send after cleared the cache. Mailbox syncing normally.,Closed Complete,Retail Banking,San Jose Office,United States,California
INC0001001,2025-05-02 17:41,Hardware,Cross-functional,Desktop Support,1 - Critical,New laptop cannot connect to Wi-Fi after reimage,"Reimaged laptop battery not charging on Wi-Fi. Updated the wireless driver, flushed the DNS cache.","updated the display driver and flushed the DNS cache. Laptop online, user confirms connectivity.",Closed,Corporate Functions,New York Office,United States,New York
INC0001020,2025-05-03 02:40,Network,Connectivity,Network Operations,4 - Low,Ethernet intermittent drops,User no internet on firewall. Ran tracert and saw high latency. reseated the Ethernet cable.,Resolved authentication failed after reset the network adapter. Latency back to normal.,Resolved,Healthcare Services,London HQ,United Kingdom,England
INC0001028,2025-05-03 08:12,Security,Identity & Access,Service Desk,2 - High,SSO access denied,New starter needs the role. reset the MFA token per the access request.,Resolved account locked after reset the password. Access verified.,Resolved,Healthcare Services,New York Office,United States,New York
INC0001078,2025-05-05 22:55,Network,Connectivity,Network Operations,2 - High,User high latency on firewall,"VPN authentication failed. Verified credentials, flushed the DNS cache.",Fixed the connection. reset the network adapter and verified the network drive maps.,Closed,Retail Banking,New York Office,United States,New York
